Birim_Id,Birim_Adi,Birim_Tur_Id,Birim_Tur_Adi,Yoksis_Id_x,Rapor_Sayisi,Yoksis_Id_y,Hedef_Sayisi,Yoksis_Id,Gerceklesen_Hedef,Planlama_Etkinligi,Rapor_Basina_Hedef,Ortalama_Hedef_Gerceklesme,Basari_Duzeyi
10936993.0,YAPI İŞLERİ VE TEKNİK DAİRE BAŞKANLIĞI,0,Tanımsız,10936993.0,1,10936993.0,467,,0,0.0,233.5,0.0,Orta
11191499.0,ALMANCA ÖĞRETMENLİĞİ BÖLÜMÜ,0,Tanımsız,11191499.0,2,11191499.0,476,,0,0.0,158.66666666666666,0.0,Orta
11488676.0,FELSEFE GRUBU ÖĞRETMENLİĞİ BÖLÜMÜ,0,Tanımsız,11488676.0,1,11488676.0,357,,0,0.0,178.5,0.0,Orta
11987284.0,SPOR YÖNETİCİLİĞİ BÖLÜM BAŞKANLIĞI,0,Tanımsız,11987284.0,1,11987284.0,357,,0,0.0,178.5,0.0,Orta
12068940.0,KİMYA MÜHENDİSLİĞİ BÖLÜM BAŞKANLIĞI,0,Tanımsız,12068940.0,1,12068940.0,357,,0,0.0,178.5,0.0,Orta
12837963.0,TÜRKOLOJİ ARAŞTIRMALARI MERKEZİ MÜDÜRLÜĞÜ,0,Tanımsız,12837963.0,1,12837963.0,375,,0,0.0,187.5,0.0,Orta
14010844.0,MİMARLIK BÖLÜM BAŞKANLIĞI,0,Tanımsız,14010844.0,3,14010844.0,476,,0,0.0,119.0,0.0,Orta
14129312.0,ADANA MESLEK YÜKSEKOKULU MÜDÜRLÜĞÜ,0,Tanımsız,14129312.0,2,14129312.0,734,,0,0.0,244.66666666666666,0.0,Orta
14310837.0,YABANCI DİLLER YÜKSEKOKULU MÜDÜRLÜĞÜ,0,Tanımsız,14310837.0,1,14310837.0,719,,0,0.0,359.5,0.0,Orta
14410203.0,İNŞAAT MÜHENDİSLİĞİ BÖLÜM BAŞKANLIĞI,0,Tanımsız,,0,14410203.0,595,,0,0.0,595.0,0.0,Orta
14751238.0,JEOLOJİ MÜHENDİSLİĞİ BÖLÜM BAŞKANLIĞI,0,Tanımsız,14751238.0,1,14751238.0,357,,0,0.0,178.5,0.0,Orta
14912232.0,ADANA GENETİK HASTALIKLARI TANI VE TEDAVİ UYGULAMA VE ARAŞTIRMA MERKEZİ MÜDÜRLÜĞÜ,0,Tanımsız,,0,14912232.0,29,,0,0.0,29.0,0.0,Orta
15038478.0,ŞEHİR VE BÖLGE PLANLAMA BÖLÜM BAŞKANLIĞI,0,Tanımsız,15038478.0,2,15038478.0,357,,0,0.0,119.0,0.0,Orta
16009750.0,TARIM MAKİNALARI VE TEKNOLOJİLERİ MÜHENDİSLİĞİ BÖLÜM BAŞKANLIĞI,0,Tanımsız,16009750.0,1,16009750.0,357,,0,0.0,178.5,0.0,Orta
16199167.0,FRANSIZCA ÖĞRETMENLİĞİ BÖLÜMÜ,0,Tanımsız,16199167.0,2,16199167.0,357,,0,0.0,119.0,0.0,Orta
16854460.0,VETERİNER FAKÜLTESİ DEKANLIĞI,0,Tanımsız,16854460.0,1,16854460.0,734,,0,0.0,367.0,0.0,Orta
17062936.0,MAKİNE MÜHENDİSLİĞİ BÖLÜM BAŞKANLIĞI,0,Tanımsız,17062936.0,1,17062936.0,357,,0,0.0,178.5,0.0,Orta
17476449.0,ADANA ORGANİZE SANAYİ BÖLGESİ TEKNİK BİLİMLER MESLEK YÜKSEKOKULU MÜDÜRLÜĞÜ,0,Tanımsız,17476449.0,1,17476449.0,734,,0,0.0,367.0,0.0,Orta
17614729.0,SUBTROPİK MEYVELER ARAŞTIRMA VE UYGULAMA MERKEZİ MÜDÜRLÜĞÜ,0,Tanımsız,17614729.0,1,17614729.0,713,,0,0.0,356.5,0.0,Orta
17811773.0,KADIN ÇALIŞMALARI ARAŞTIRMA VE UYGULAMA MERKEZİ,0,Tanımsız,,0,17811773.0,290,,0,0.0,290.0,0.0,Orta
18215143.0,BOTANİK BAHÇESİ UYGULAMA VE ARAŞTIRMA MERKEZİ MÜDÜRLÜĞÜ,0,Tanımsız,,0,18215143.0,182,,0,0.0,182.0,0.0,Orta
18371001.0,MERKEZ DANIŞMA KURULU,0,Tanımsız,,0,18371001.0,238,,0,0.0,238.0,0.0,Orta
18483472.0,ZİRAAT FAKÜLTESİ DEKANLIĞI,0,Tanımsız,18483472.0,3,18483472.0,734,,0,0.0,183.5,0.0,Orta
18560954.0,ECZACILIK FAKÜLTESİ DEKANLIĞI,0,Tanımsız,18560954.0,1,18560954.0,615,,0,0.0,307.5,0.0,Orta
19147728.0,BAHÇE BİTKİLERİ BÖLÜM BAŞKANLIĞI,0,Tanımsız,,0,19147728.0,357,,0,0.0,357.0,0.0,Orta
19235313.0,CEYHAN MESLEK YÜKSEKOKULU MÜDÜRLÜĞÜ,0,Tanımsız,19235313.0,1,19235313.0,387,,0,0.0,193.5,0.0,Orta
19337145.0,İLKÖĞRETİM MATEMATİK  ÖĞRETMENLİĞİ BÖLÜMÜ,0,Tanımsız,19337145.0,1,19337145.0,357,,0,0.0,178.5,0.0,Orta
20025170.0,SERAMİK BÖLÜM BAŞKANLIĞI,0,Tanımsız,20025170.0,2,20025170.0,595,,0,0.0,198.33333333333334,0.0,Orta
20322347.0,BİLGİSAYAR BİLİMLERİ BÖLÜM BAŞKANLIĞI,0,Tanımsız,20322347.0,1,20322347.0,119,,0,0.0,59.5,0.0,Orta
22370997.0,BEDEN EĞİTİMİ VE SPOR BÖLÜM BAŞKANLIĞI,0,Tanımsız,22370997.0,1,22370997.0,476,,0,0.0,238.0,0.0,Orta
23142722.0,KLİNİK BİLİMLER BÖLÜM BAŞKANLIĞI,0,Tanımsız,,0,23142722.0,40,,0,0.0,40.0,0.0,Orta
23584323.0,TOPLUMSAL KATKI KOORDİNATÖRLÜĞÜ,0,Tanımsız,23584323.0,2,23584323.0,795,,0,0.0,265.0,0.0,Orta
24047635.0,İNGİLİZCE  ÖĞRETMENLİĞİ BÖLÜMÜ,0,Tanımsız,24047635.0,2,24047635.0,357,,0,0.0,119.0,0.0,Orta
24128361.0,ELEKTRİK-ELEKTRONİK MÜHENDİSLİĞİ BÖLÜM BAŞKANLIĞI,0,Tanımsız,24128361.0,1,24128361.0,595,,0,0.0,297.5,0.0,Orta
24173324.0,DEVLET KONSERVATUVARI MÜDÜRLÜĞÜ,0,Tanımsız,24173324.0,2,24173324.0,615,,0,0.0,205.0,0.0,Orta
24574346.0,ALADAĞ MESLEK YÜKSEKOKULU MÜDÜRLÜĞÜ,0,Tanımsız,24574346.0,2,24574346.0,838,,0,0.0,279.3333333333333,0.0,Orta
24789552.0,İŞLETME BÖLÜM BAŞKANLIĞI,0,Tanımsız,24789552.0,2,24789552.0,357,,0,0.0,119.0,0.0,Orta
25458317.0,TURİZM İŞLETMECİLİĞİ VE OTELCİLİK YÜKSEKOKULU MÜDÜRLÜĞÜ,0,Tanımsız,,0,25458317.0,503,,0,0.0,503.0,0.0,Orta
26467027.0,MERKEZ YÖNETİM KURULU,0,Tanımsız,,0,26467027.0,238,,0,0.0,238.0,0.0,Orta
26675998.0,TARIMSAL YAYIM HABERLEŞME ARAŞTIRMA VE UYGULAMA MERKEZİ MÜDÜRLÜĞÜ,0,Tanımsız,26675998.0,1,26675998.0,373,,0,0.0,186.5,0.0,Orta
27023365.0,TEMEL EĞİTİM BÖLÜM BAŞKANLIĞI,0,Tanımsız,27023365.0,1,27023365.0,476,,0,0.0,238.0,0.0,Orta
27224817.0,ÖĞRENCİ İŞLERİ DAİRE BAŞKANLIĞI,0,Tanımsız,27224817.0,1,27224817.0,631,,0,0.0,315.5,0.0,Orta
28736669.0,TEKSTİL MÜHENDİSLİĞİ BÖLÜM BAŞKANLIĞI,0,Tanımsız,28736669.0,2,28736669.0,357,,0,0.0,119.0,0.0,Orta
28758125.0,REHBERLİK VE PSİKOLOJİK DANIŞMANLIK BÖLÜMÜ,0,Tanımsız,28758125.0,2,28758125.0,357,,0,0.0,119.0,0.0,Orta
28806006.0,İMAMOĞLU MESLEK YÜKSEKOKULU MÜDÜRLÜĞÜ,0,Tanımsız,,0,28806006.0,719,,0,0.0,719.0,0.0,Orta
28865886.0,GIDA MÜHENDİSLİĞİ BÖLÜM BAŞKANLIĞI,0,Tanımsız,,0,28865886.0,476,,0,0.0,476.0,0.0,Orta
29157482.0,ÇOCUK KORUMA UYGULAMA VE ARAŞTIRMA MERKEZİ MÜDÜRLÜĞÜ,0,Tanımsız,,0,29157482.0,10,,0,0.0,10.0,0.0,Orta
29520749.0,EĞİTİM FAKÜLTESİ DEKANLIĞI,0,Tanımsız,,0,29520749.0,615,,0,0.0,615.0,0.0,Orta
29655484.0,SPOR BİLİMLERİ FAKÜLTESİ DEKANLIĞI,0,Tanımsız,29655484.0,2,29655484.0,838,,0,0.0,279.3333333333333,0.0,Orta
29920486.0,TÜRKÇE ÖĞRETİMİ ARAŞTIRMA VE UYGULAMA MERKEZİ MÜDÜRLÜĞÜ,0,Tanımsız,,0,29920486.0,254,,0,0.0,254.0,0.0,Orta
30627815.0,ARKEOLOJİ BÖLÜM BAŞKANLIĞI,0,Tanımsız,30627815.0,1,30627815.0,357,,0,0.0,178.5,0.0,Orta
31903149.0,KİMYA BÖLÜM BAŞKANLIĞI,0,Tanımsız,31903149.0,2,31903149.0,476,,0,0.0,158.66666666666666,0.0,Orta
32317864.0,ÇEVRE MÜHENDİSLİĞİ BÖLÜM BAŞKANLIĞI,0,Tanımsız,,0,32317864.0,476,,0,0.0,476.0,0.0,Orta
32869392.0,GÖÇ VE KALKINMA ÇALIŞMALARI UYGULAMA VE ARAŞTIRMA MERKEZİ MÜDÜRLÜĞÜ,0,Tanımsız,,0,32869392.0,282,,0,0.0,282.0,0.0,Orta
33475661.0,TARİH BÖLÜM BAŞKANLIĞI,0,Tanımsız,33475661.0,2,33475661.0,357,,0,0.0,119.0,0.0,Orta
33576376.0,TARLA BİTKİLERİ BÖLÜM BAŞKANLIĞI,0,Tanımsız,33576376.0,1,33576376.0,357,,0,0.0,178.5,0.0,Orta
33765793.0,SINIF ÖĞRETMENLİĞİ BÖLÜMÜ,0,Tanımsız,33765793.0,1,33765793.0,476,,0,0.0,238.0,0.0,Orta
36613639.0,MATEMATİK BÖLÜM BAŞKANLIĞI,0,Tanımsız,36613639.0,1,36613639.0,476,,0,0.0,238.0,0.0,Orta
37632145.0,RESİM BÖLÜM BAŞKANLIĞI,0,Tanımsız,,0,37632145.0,357,,0,0.0,357.0,0.0,Orta
38352607.0,KARAİSALI MESLEK YÜKSEKOKULU MÜDÜRLÜĞÜ,0,Tanımsız,,0,38352607.0,615,,0,0.0,615.0,0.0,Orta
40181749.0,İSTATİSTİK UYGULAMA VE ARAŞTIRMA MERKEZİ MÜDÜRLÜĞÜ,0,Tanımsız,,0,40181749.0,10,,0,0.0,10.0,0.0,Orta
40257271.0,POZANTI MESLEK YÜKSEKOKULU MÜDÜRLÜĞÜ,0,Tanımsız,40257271.0,3,40257271.0,615,,0,0.0,153.75,0.0,Orta
41033997.0,İKTİSAT BÖLÜM BAŞKANLIĞI,0,Tanımsız,41033997.0,2,41033997.0,357,,0,0.0,119.0,0.0,Orta
41068473.0,YUMURTALIK MESLEK YÜKSEKOKULU MÜDÜRLÜĞÜ,0,Tanımsız,41068473.0,1,41068473.0,615,,0,0.0,307.5,0.0,Orta
41324129.0,PSİKOLOJİ BÖLÜM BAŞKANLIĞI,0,Tanımsız,41324129.0,2,41324129.0,595,,0,0.0,198.33333333333334,0.0,Orta
41681049.0,BİLGİ İŞLEM DAİRE BAŞKANLIĞI,0,Tanımsız,41681049.0,1,41681049.0,821,,0,0.0,410.5,0.0,Orta
41829783.0,"TEKSTİL, GİYİM, AYAKKABI VE DERİ BÖLÜM BAŞKANLIĞI",0,Tanımsız,,0,41829783.0,357,,0,0.0,357.0,0.0,Orta
42036022.0,BİLGİSAYAR MÜHENDİSLİĞİ BÖLÜM BAŞKANLIĞI,0,Tanımsız,,0,42036022.0,401,,0,0.0,401.0,0.0,Orta
44067625.0,PERİNATAL TANI ARAŞTIRMA VE UYGULAMA MERKEZİ MÜDÜRLÜĞÜ,0,Tanımsız,,0,44067625.0,16,,0,0.0,16.0,0.0,Orta
44223406.0,KALITSAL KAN HASTALIKLARI ARAŞTIRMA VE UYGULAMA MERKEZİ MÜDÜRLÜĞÜ,0,Tanımsız,,0,44223406.0,16,,0,0.0,16.0,0.0,Orta
45346595.0,SOSYAL BİLGİLER ÖĞRETMENLİĞİ BÖLÜMÜ,0,Tanımsız,45346595.0,2,45346595.0,357,,0,0.0,119.0,0.0,Orta
45537984.0,SOSYAL BİLİMLER ENSTİTÜSÜ MÜDÜRLÜĞÜ,0,Tanımsız,45537984.0,3,45537984.0,600,,0,0.0,150.0,0.0,Orta
45779534.0,İŞLETME BÖLÜM BAŞKANLIĞI,0,Tanımsız,45779534.0,1,45779534.0,476,,0,0.0,238.0,0.0,Orta
46068300.0,İLETİŞİM FAKÜLTESİ DEKANLIĞI,0,Tanımsız,46068300.0,1,46068300.0,600,,0,0.0,300.0,0.0,Orta
46232573.0,MADEN MÜHENDİSLİĞİ BÖLÜM BAŞKANLIĞI,0,Tanımsız,46232573.0,2,46232573.0,476,,0,0.0,158.66666666666666,0.0,Orta
46702655.0,ENDÜSTRİ MÜHENDİSLİĞİ BÖLÜM BAŞKANLIĞI,0,Tanımsız,46702655.0,2,46702655.0,362,,0,0.0,120.66666666666667,0.0,Orta
46769491.0,ANTRENÖRLÜK EĞİTİMİ BÖLÜM BAŞKANLIĞI,0,Tanımsız,46769491.0,2,46769491.0,357,,0,0.0,119.0,0.0,Orta
47499371.0,ULUSLARARASI ÖĞRENCİ OFİSİ,0,Tanımsız,,0,47499371.0,357,,0,0.0,357.0,0.0,Orta
49072411.0,ÇEVRE SORUNLARI ARAŞTIRMA VE UYGULAMA MERKEZİ MÜDÜRLÜĞÜ,0,Tanımsız,,0,49072411.0,375,,0,0.0,375.0,0.0,Orta
49457580.0,HUKUK FAKÜLTESİ DEKANLIĞI,0,Tanımsız,49457580.0,1,49457580.0,719,,0,0.0,359.5,0.0,Orta
49884491.0,BİYOMEDİKAL MÜHENDİSLİĞİ BÖLÜM BAŞKANLIĞI,0,Tanımsız,49884491.0,2,49884491.0,357,,0,0.0,119.0,0.0,Orta
50269082.0,İLAHİYAT FAKÜLTESİ DEKANLIĞI,0,Tanımsız,,0,50269082.0,600,,0,0.0,600.0,0.0,Orta
50907043.0,UZAKTAN EĞİTİM UYGULAMA VE ARAŞTIRMA MERKEZİ MÜDÜRLÜĞÜ,0,Tanımsız,,0,50907043.0,342,,0,0.0,342.0,0.0,Orta
51087304.0,KOZAN MESLEK YÜKSEKOKULU MÜDÜRLÜĞÜ,0,Tanımsız,51087304.0,2,51087304.0,734,,0,0.0,244.66666666666666,0.0,Orta
51143002.0,ZOOTEKNİ BÖLÜM BAŞKANLIĞI,0,Tanımsız,51143002.0,3,51143002.0,476,,0,0.0,119.0,0.0,Orta
51413145.0,MÜHENDİSLİK FAKÜLTESİ DEKANLIĞI,0,Tanımsız,51413145.0,1,51413145.0,920,,0,0.0,460.0,0.0,Orta
51440180.0,BİTKİ KORUMA BÖLÜM BAŞKANLIĞI,0,Tanımsız,51440180.0,1,51440180.0,357,,0,0.0,178.5,0.0,Orta
52739535.0,ULUSLARARASI ÖĞRENCİ KOORDİNASYON UYGULAMA VE ARAŞTIRMA MERKEZİ MÜDÜRLÜĞÜ,0,Tanımsız,52739535.0,1,52739535.0,373,,0,0.0,186.5,0.0,Orta
53492241.0,TÜRKÇE ÖĞRETMENLİĞİ BÖLÜMÜ,0,Tanımsız,53492241.0,1,53492241.0,357,,0,0.0,178.5,0.0,Orta
53493149.0,STRATEJİ GELİŞTİRME DAİRE BAŞKANLIĞI,0,Tanımsız,,0,53493149.0,586,,0,0.0,586.0,0.0,Orta
53592956.0,MALİYE BÖLÜM BAŞKANLIĞI,0,Tanımsız,53592956.0,1,53592956.0,476,,0,0.0,238.0,0.0,Orta
54572647.0,AİLE PLANLAMASI VE İNFERTİLİTE ARAŞTIRMA VE UYGULAMA MERKEZİ MÜDÜRLÜĞÜ,0,Tanımsız,,0,54572647.0,16,,0,0.0,16.0,0.0,Orta
54960065.0,EĞİTİM KOORDİNATÖRLÜĞÜ,0,Tanımsız,,0,54960065.0,258,,0,0.0,258.0,0.0,Orta
55517630.0,GAZETECİLİK BÖLÜM BAŞKANLIĞI,0,Tanımsız,,0,55517630.0,357,,0,0.0,357.0,0.0,Orta
55801824.0,PAMUK ARAŞTIRMA VE UYGULAMA MERKEZİ MÜDÜRLÜĞÜ,0,Tanımsız,,0,55801824.0,16,,0,0.0,16.0,0.0,Orta
56559381.0,İKTİSADİ VE İDARİ BİLİMLER FAKÜLTESİ DEKANLIĞI,0,Tanımsız,56559381.0,1,56559381.0,600,,0,0.0,300.0,0.0,Orta
56737980.0,TURİZM İŞLETMECİLİĞİ BÖLÜM BAŞKANLIĞI ,0,Tanımsız,56737980.0,1,56737980.0,238,,0,0.0,119.0,0.0,Orta
57135873.0,HEMŞİRELİK BÖLÜM BAŞKANLIĞI,0,Tanımsız,57135873.0,2,57135873.0,357,,0,0.0,119.0,0.0,Orta
57429177.0,SUALTI UYGULAMA VE ARAŞTIRMA MERKEZİ MÜDÜRLÜĞÜ,0,Tanımsız,,0,57429177.0,248,,0,0.0,248.0,0.0,Orta
57861215.0,BAĞIMLILIK VE ADLİ BİLİMLER ENSTİTÜSÜ MÜDÜRLÜĞÜ,0,Tanımsız,57861215.0,4,57861215.0,719,,0,0.0,143.8,0.0,Orta
57897348.0,PERSONEL DAİRE BAŞKANLIĞI,0,Tanımsız,57897348.0,2,57897348.0,710,,0,0.0,236.66666666666666,0.0,Orta
57912599.0,BİYOLOJİ BÖLÜM BAŞKANLIĞI,0,Tanımsız,57912599.0,1,57912599.0,357,,0,0.0,178.5,0.0,Orta
57995506.0,SAĞLIK BİLİMLERİ FAKÜLTESİ DEKANLIĞI,0,Tanımsız,57995506.0,2,57995506.0,615,,0,0.0,205.0,0.0,Orta
58512220.0,GENETİK VE EMBRİYO MÜHENDİSLİĞİ ARAŞTIRMA VE UYGULAMA MERKEZİ MÜDÜRLÜĞÜ,0,Tanımsız,,0,58512220.0,8,,0,0.0,8.0,0.0,Orta
59565534.0,BALCALI HASTANESİ BAŞHEKİMLİĞİ,0,Tanımsız,59565534.0,1,59565534.0,611,,0,0.0,305.5,0.0,Orta
60010129.0,SAĞLIK ARAŞTIRMA VE UYGULAMA MERKEZİ MÜDÜRLÜĞÜ,0,Tanımsız,,0,60010129.0,135,,0,0.0,135.0,0.0,Orta
60162390.0,SINAV UYGULAMA VE ARAŞTIRMA MERKEZİ MÜDÜRLÜĞÜ,0,Tanımsız,,0,60162390.0,248,,0,0.0,248.0,0.0,Orta
61617888.0,MAKİNE ALET CİHAZ TASARIM İMALAT ARAŞTIRMA VE UYGULAMA MERKEZİ MÜDÜRLÜĞÜ,0,Tanımsız,,0,61617888.0,16,,0,0.0,16.0,0.0,Orta
62623089.0,FİZİK BÖLÜM BAŞKANLIĞI,0,Tanımsız,62623089.0,2,62623089.0,357,,0,0.0,119.0,0.0,Orta
62761666.0,BİYOTEKNOLOJİ ARAŞTIRMA VE UYGULAMA MERKEZİ MÜDÜRLÜĞÜ,0,Tanımsız,,0,62761666.0,492,,0,0.0,492.0,0.0,Orta
63210399.0,FEN BİLGİSİ ÖĞRETMENLİĞİ BÖLÜM BAŞKANLIĞI,0,Tanımsız,63210399.0,2,63210399.0,476,,0,0.0,158.66666666666666,0.0,Orta
63363731.0,"İŞ SAĞLIĞI VE GÜVENLİĞİ EĞİTİM, UYGULAMA VE ARAŞTIRMA MERKEZİ MÜDÜRLÜĞÜ",0,Tanımsız,63363731.0,3,63363731.0,699,,0,0.0,174.75,0.0,Orta
64039391.0,FEN EDEBİYAT FAKÜLTESİ DEKANLIĞI,0,Tanımsız,64039391.0,1,64039391.0,734,,0,0.0,367.0,0.0,Orta
64744009.0,TUFANBEYLİ MESLEK YÜKSEKOKULU MÜDÜRLÜĞÜ,0,Tanımsız,64744009.0,2,64744009.0,600,,0,0.0,200.0,0.0,Orta
65822199.0,BİLİMSEL ARAŞTIRMA PROJELERİ KOORDİNATÖRLÜĞÜ,0,Tanımsız,,0,65822199.0,465,,0,0.0,465.0,0.0,Orta
66449092.0,EKONOMETRİ BÖLÜM BAŞKANLIĞI,0,Tanımsız,66449092.0,2,66449092.0,357,,0,0.0,119.0,0.0,Orta
67678035.0,DİŞ HEKİMLİĞİ FAKÜLTESİ DEKANLIĞI,0,Tanımsız,,0,67678035.0,280,,0,0.0,280.0,0.0,Orta
68552214.0,TROPİKAL HASTALIKLAR ARAŞTIRMA VE UYGULAMA MERKEZİ MÜDÜRLÜĞÜ,0,Tanımsız,,0,68552214.0,16,,0,0.0,16.0,0.0,Orta
68608914.0,TÜRK DİLİ VE EDEBİYATI BÖLÜM BAŞKANLIĞI,0,Tanımsız,68608914.0,3,68608914.0,357,,0,0.0,89.25,0.0,Orta
69258992.0,ORGAN NAKLİ ARAŞTIRMA VE UYGULAMA MERKEZİ MÜDÜRLÜĞÜ,0,Tanımsız,,0,69258992.0,16,,0,0.0,16.0,0.0,Orta
69848408.0,KARİYER PLANLAMA ARAŞTIRMA VE UYGULAMA MERKEZİ MÜDÜRLÜĞÜ,0,Tanımsız,69848408.0,2,69848408.0,586,,0,0.0,195.33333333333334,0.0,Orta
69875614.0,KÜLTÜRLERARASI İLETİŞİM ÇALIŞMALARI UYGULAMA VE ARAŞTIRMA MERKEZİ MÜDÜRLÜĞÜ,0,Tanımsız,,0,69875614.0,134,,0,0.0,134.0,0.0,Orta
71058867.0,OKUL ÖNCESİ ÖĞRETMENLİĞİ BÖLÜM BAŞKANLIĞI,0,Tanımsız,71058867.0,1,71058867.0,476,,0,0.0,238.0,0.0,Orta
71608477.0,UZAY BİLİMLERİ VE GÜNEŞ ENERJİSİ ARAŞTIRMA VE UYGULAMA MERKEZİ MÜDÜRLÜĞÜ,0,Tanımsız,,0,71608477.0,373,,0,0.0,373.0,0.0,Orta
72458785.0,MAKİNE MÜHENDİSLİĞİ BÖLÜM BAŞKANLIĞI,0,Tanımsız,,0,72458785.0,357,,0,0.0,357.0,0.0,Orta
72544736.0,MÜZİK BİLİMLERİ BÖLÜM BAŞKANLIĞI,0,Tanımsız,72544736.0,1,72544736.0,357,,0,0.0,178.5,0.0,Orta
72785209.0,GÜZEL SANATLAR FAKÜLTESİ DEKANLIĞI,0,Tanımsız,72785209.0,1,72785209.0,615,,0,0.0,307.5,0.0,Orta
72821215.0,MERKEZ İDARİ İŞLER KOORDİNATÖRLÜĞÜ,0,Tanımsız,,0,72821215.0,119,,0,0.0,119.0,0.0,Orta
73496254.0,KALİTE KOORDİNATÖRLÜĞÜ,0,Tanımsız,73496254.0,1,73496254.0,819,,0,0.0,409.5,0.0,Orta
74891916.0,GRAFİK BÖLÜM BAŞKANLIĞI,0,Tanımsız,74891916.0,2,74891916.0,357,,0,0.0,119.0,0.0,Orta
75115588.0,ATATÜRK İLKELERİ VE İNKILAP TARİHİ ARAŞTIRMA VE UYGULAMA MERKEZİ MÜDÜRLÜĞÜ,0,Tanımsız,,0,75115588.0,365,,0,0.0,365.0,0.0,Orta
76028928.0,EBELİK BÖLÜM BAŞKANLIĞI,0,Tanımsız,76028928.0,1,76028928.0,476,,0,0.0,238.0,0.0,Orta
78707876.0,FEN BİLİMLERİ ENSTİTÜSÜ MÜDÜRLÜĞÜ,0,Tanımsız,78707876.0,2,78707876.0,615,,0,0.0,205.0,0.0,Orta
79508372.0,SAĞLIK KÜLTÜR VE SPOR DAİRE BAŞKANLIĞI,0,Tanımsız,,0,79508372.0,710,,0,0.0,710.0,0.0,Orta
80739418.0,TOPRAK BİLİMİ VE BİTKİ BESLEME BÖLÜM BAŞKANLIĞI,0,Tanımsız,80739418.0,3,80739418.0,476,,0,0.0,119.0,0.0,Orta
80777025.0,BİLGİSAYAR VE ÖĞRETİM TEKNOLOJİLERİ EĞİTİMİ BÖLÜM BAŞKANLIĞI,0,Tanımsız,80777025.0,2,80777025.0,476,,0,0.0,158.66666666666666,0.0,Orta
81362332.0,DIŞ İLİŞKİLER BİRİMİ,0,Tanımsız,,0,81362332.0,493,,0,0.0,493.0,0.0,Orta
82252433.0,TÜMÖR ARAŞTIRMA VE TEDAVİ UYGULAMA MERKEZİ MÜDÜRLÜĞÜ,0,Tanımsız,,0,82252433.0,135,,0,0.0,135.0,0.0,Orta
82295611.0,İDARİ VE MALİ İŞLER DAİRE BAŞKANLIĞI,0,Tanımsız,82295611.0,3,82295611.0,689,,0,0.0,172.25,0.0,Orta
82450252.0,İLETİŞİM BİLİMLERİ BÖLÜM BAŞKANLIĞI,0,Tanımsız,82450252.0,1,82450252.0,357,,0,0.0,178.5,0.0,Orta
84436893.0,OTOMOTİV MÜHENDİSLİĞİ BÖLÜM BAŞKANLIĞI,0,Tanımsız,84436893.0,3,84436893.0,595,,0,0.0,148.75,0.0,Orta
84610074.0,TEKSTİL VE MODA TASARIM BÖLÜM BAŞKANLIĞI,0,Tanımsız,84610074.0,1,84610074.0,476,,0,0.0,238.0,0.0,Orta
84900206.0,İSTATİSTİK BÖLÜM BAŞKANLIĞI,0,Tanımsız,,0,84900206.0,476,,0,0.0,476.0,0.0,Orta
85391342.0,SAĞLIKLI YAŞAM VE SPOR BİLİMLERİ UYGULAMA VE ARAŞTIRMA MERKEZİ MÜDÜRLÜĞÜ,0,Tanımsız,85391342.0,1,85391342.0,243,,0,0.0,121.5,0.0,Orta
85700757.0,HALİL AVCI DUYMA ENGELLİ VE ÖZÜRLÜLERİ ARAŞTIRMA VE UYGULAMA MERKEZİ MÜDÜRLÜĞÜ,0,Tanımsız,85700757.0,2,85700757.0,492,,0,0.0,164.0,0.0,Orta
86442031.0,KÜTÜPHANE VE DOKÜMANTASYON DAİRE BAŞKANLIĞI,0,Tanımsız,86442031.0,3,86442031.0,707,,0,0.0,176.75,0.0,Orta
86579176.0,CEYHAN MÜHENDİSLİK FAKÜLTESİ DEKANLIĞI,0,Tanımsız,86579176.0,1,86579176.0,387,,0,0.0,193.5,0.0,Orta
87207590.0,EKONOMETRİ ANABİLİM DALI BAŞKANLIĞI,0,Tanımsız,87207590.0,1,87207590.0,357,,0,0.0,178.5,0.0,Orta
88443122.0,TARIM EKONOMİSİ BÖLÜM BAŞKANLIĞI,0,Tanımsız,88443122.0,1,88443122.0,357,,0,0.0,178.5,0.0,Orta
88625494.0,RESİM-İŞ ÖĞRETMENLİĞİ BÖLÜM BAŞKANLIĞI,0,Tanımsız,88625494.0,1,88625494.0,476,,0,0.0,238.0,0.0,Orta
89185944.0,SU ÜRÜNLERİ FAKÜLTESİ DEKANLIĞI,0,Tanımsız,89185944.0,2,89185944.0,481,,0,0.0,160.33333333333334,0.0,Orta
90007838.0,ARKEOLOJİK ARAŞTIRMA VE UYGULAMA MERKEZİ MÜDÜRLÜĞÜ,0,Tanımsız,,0,90007838.0,16,,0,0.0,16.0,0.0,Orta
90731410.0,MİMARLIK FAKÜLTESİ DEKANLIĞI,0,Tanımsız,,0,90731410.0,734,,0,0.0,734.0,0.0,Orta
91283923.0,TARIMSAL YAPILAR VE SULAMA BÖLÜM BAŞKANLIĞI,0,Tanımsız,91283923.0,3,91283923.0,357,,0,0.0,89.25,0.0,Orta
91734988.0,BEDEN EĞİTİMİ ÖĞRETMENLİĞİ BÖLÜM BAŞKANLIĞI,0,Tanımsız,,0,91734988.0,357,,0,0.0,357.0,0.0,Orta
92458542.0,İÇ MİMARLIK BÖLÜM BAŞKANLIĞI,0,Tanımsız,92458542.0,2,92458542.0,595,,0,0.0,198.33333333333334,0.0,Orta
93386610.0,ABDİ SÜTCÜ SAĞLIK HİZMETLERİ MESLEK YÜKSEKOKULU MÜDÜRLÜĞÜ,0,Tanımsız,93386610.0,2,93386610.0,838,,0,0.0,279.3333333333333,0.0,Orta
93527295.0,KİŞİSEL VERİLERİN KORUNMASI BİRİMİ,0,Tanımsız,93527295.0,1,93527295.0,483,,0,0.0,241.5,0.0,Orta
94871493.0,SÜREKLİ EĞİTİM UYGULAMA VE ARAŞTIRMA MERKEZİ MÜDÜRLÜĞÜ,0,Tanımsız,94871493.0,1,94871493.0,506,,0,0.0,253.0,0.0,Orta
95874904.0,MERKEZİ ARAŞTIRMA LABORATUVARI,0,Tanımsız,95874904.0,1,95874904.0,238,,0,0.0,119.0,0.0,Orta
96078650.0,TIP FAKÜLTESİ DEKANLIĞI,0,Tanımsız,96078650.0,2,96078650.0,734,,0,0.0,244.66666666666666,0.0,Orta
96291591.0,PEYZAJ MİMARLIĞI BÖLÜM BAŞKANLIĞI,0,Tanımsız,96291591.0,2,96291591.0,476,,0,0.0,158.66666666666666,0.0,Orta
96631441.0,SAĞLIK BİLİMLERİ ENSTİTÜSÜ MÜDÜRLÜĞÜ,0,Tanımsız,96631441.0,1,96631441.0,719,,0,0.0,359.5,0.0,Orta
97222925.0,"RADYO, TELEVİZYON VE SİNEMA BÖLÜM BAŞKANLIĞI",0,Tanımsız,97222925.0,3,97222925.0,476,,0,0.0,119.0,0.0,Orta
97940628.0,ENGELSİZ ÜNİVERSİTE KOORDİNATÖRLÜĞÜ,0,Tanımsız,97940628.0,2,97940628.0,463,,0,0.0,154.33333333333334,0.0,Orta
98008867.0,KOZAN İŞLETME FAKÜLTESİ DEKANLIĞI,0,Tanımsız,98008867.0,1,98008867.0,402,,0,0.0,201.0,0.0,Orta
98385192.0,POZANTI TARIMSAL ARAŞTIRMA VE UYGULAMA MERKEZİ MÜDÜRLÜĞÜ,0,Tanımsız,,0,98385192.0,16,,0,0.0,16.0,0.0,Orta
99038722.0,GASTRONOMİ VE MUTFAK SANATLARI BÖLÜM BAŞKANLIĞI,0,Tanımsız,99038722.0,2,99038722.0,238,,0,0.0,79.33333333333333,0.0,Orta
99065269.0,FOTOĞRAF BÖLÜM BAŞKANLIĞI,0,Tanımsız,,0,99065269.0,357,,0,0.0,357.0,0.0,Orta
99574547.0,STRATEJİK UYGULAMA VE ARAŞTIRMA MERKEZİ MÜDÜRLÜĞÜ,0,Tanımsız,,0,99574547.0,129,,0,0.0,129.0,0.0,Orta
99834507.0,SAĞLIK BİLİMLERİ DENEYSEL UYGULAMA VE ARAŞTIRMA MERKEZİ,0,Tanımsız,,0,99834507.0,10,,0,0.0,10.0,0.0,Orta
99999999.0,SİYASET BİLİMİ VE ULUSLARARASI İLİŞKİLER BÖLÜMÜ,0,Tanımsız,99999999.0,1,99999999.0,357,,0,0.0,178.5,0.0,Orta
100000000.0,ARAŞTIRMA VE GELİŞTİRME STRATEJİLERİ KOORDİNATÖRLÜĞÜ,0,Tanımsız,100000000.0,1,100000000.0,390,,0,0.0,195.0,0.0,Orta
100010005.0,Ç.Ü.  EĞİTİM KOORDİNATÖRLÜĞÜ,0,Tanımsız,100010005.0,1,100010005.0,227,,0,0.0,113.5,0.0,Orta
